{
  "$schema": "../definition.schema.json",
  "id": "live-summary",
  "title": "Live Summary",
  "description": "Summarizes the recent meeting content in just three lines.",
  "implemented": true,
  "default": true,
  "cloud_only": false,
  "plugins": ["listener", "db"],
  "tags": ["local", "realtime", "STT", "speech-to-text", "LLM", "AI"]
}
